{
  "$schema": "./schema.json",
  "general": {
    "firstname": "Antoine",
    "lastname": "Barbier",
    "role": "Frontend Developer",
    "grade": "A",
    "entity": "ISD",
    "team": "INNOVATION STRATEGY & DESIGN",
    "description": "Frontend web developer specialized in JS development and Design System implementation. Strong interest in design.\nGraduated in 2022 with a Master's degree in Software Engineering from the Faculty of Sciences in Montpellier.",
    "linkedin": "antoinebarbier022",
    "twitter": "-"
  },
  "formations": [
    "Master's in Software Engineering (2020 - 2022)",
    "Bachelor's in Computer Science (2017 - 2020)",
    "Baccalaureate in Life Sciences and Computer Science (2017)"
  ],
  "employment_history": ["Deliveroo"],
  "articles_and_others": [],
  "sectors": [],
  "skills": [
    "Javascript/Typescript",
    "React, VueJs, Lit, Angular",
    "Storybook",
    "HTML, CSS / SCSS / Tailwind",
    "Apollo (GraphQL)",
    "Figma"
  ],
  "languages": ["French – Fluent", "English – B1"],
  "experiences": [
    {
      "program": "MS Study Copilot",
      "client": "Microsoft",
      "role": "Developer",
      "date": "(06/24)",
      "context": "",
      "contribution": ""
    },
    {
      "program": "Prompt Academy JS",
      "client": "Capgemini Invent",
      "role": "Developer",
      "date": "(05/24)",
      "context": "",
      "contribution": ""
    },
    {
      "program": "GenAI MVP MRSIE",
      "client": "Ministère de l'intérieur",
      "role": "Developer",
      "date": "(04/24 - 09/24)",
      "context": "",
      "contribution": ""
    },
    {
      "program": "Mesure Affluence",
      "client": "RATP",
      "role": "Developer",
      "date": "(04/24)",
      "context": "",
      "contribution": ""
    },
    {
      "program": "GenAI FragWizard POC Mobile",
      "client": "Channel",
      "role": "Developer",
      "date": "(03/24)",
      "context": "",
      "contribution": ""
    },
    {
      "program": "POC GenAI Chatbot",
      "client": "Stellantis",
      "role": "Developer",
      "date": "(02/24)",
      "context": "",
      "contribution": ""
    },
    {
      "program": "POC RAG KO CAP",
      "client": "Capgemini",
      "role": "Developer",
      "date": "(01/24 - 02/24)",
      "context": "",
      "contribution": ""
    },
    {
      "program": "POC GenAI SI Europe",
      "client": "Ministère de l'intérieur",
      "role": "Developer",
      "date": "(01/24 - 02/24)",
      "context": "",
      "contribution": ""
    },
    {
      "program": "POC MESDMP",
      "client": "AVV frog",
      "role": "Developer",
      "date": "(12/23)",
      "context": "",
      "contribution": ""
    },
    {
      "program": "GenAI FragGPT",
      "client": "Channel",
      "role": "Developer",
      "date": "(11/23)",
      "context": "",
      "contribution": ""
    },
    {
      "program": "POC GenAI",
      "client": "SANOFI",
      "role": "Developer",
      "date": "(09/23 – 10/23)",
      "context": "",
      "contribution": "Set up a frontend web application for a client demonstration. Tools: React, MUI JOY, React Query, i18n"
    },
    {
      "program": "NOMINEO",
      "client": "Generali",
      "role": "Creative Technologist",
      "date": "(08/23 – 09/23)",
      "context": "",
      "contribution": "Assisted the client in setting up Storybook and the component library + developed initial components. Tools: Angular, Angular Material, Storybook"
    },
    {
      "program": "Asgard",
      "client": "Internal",
      "role": "Project Manager and Frontend Developer",
      "date": "(06/23 – Present)",
      "context": "",
      "contribution": "Web application for technical monitoring at frog. Established a team and SCRUM methodology, frontend development, design of mockups. Tools: Jira, Figma. Tech: React, Storybook"
    },
    {
      "program": "Mobility4you",
      "client": "BNP Paribas",
      "role": "Developer",
      "date": "(11/22 – 06/23)",
      "context": "Website for vehicle rentals and purchases.",
      "contribution": "Developed pages and web components for an external integrator. Tech: Lit (web components), Storybook"
    },
    {
      "program": "GARNIER",
      "client": "L’OREAL",
      "role": "Developer",
      "date": "(06/22 – 07/22)",
      "context": "Showcase website template for Garnier brand products.",
      "contribution": "Frontend contribution and bug resolution. Tech: VueJS, Tailwind"
    },
    {
      "program": "POC: Design Tokens Automation",
      "client": "Internal frog",
      "role": "Developer",
      "date": "(05/23)",
      "context": "Automatic conversion of design tokens from Figma to a GitHub repository.",
      "contribution": "Development of the POC, automatic changelog, package. Tools: Style Dictionary, GitHub"
    },
    {
      "program": "CRAconverter",
      "client": "Internal frog",
      "role": "Developer",
      "date": "(11/22)",
      "context": "Website to format CSV files",
      "contribution": "Understanding the requirement and proposing a solution, development of a tool in 1 week, testing, design. Tech: REACT, ElectronJs, Storybook"
    },
    {
      "program": "Popcorn",
      "client": "Internal frog",
      "role": "Developer",
      "date": "(10/22 – 11/22)",
      "context": "Contribution to the Popcorn time tracking application",
      "contribution": "Refactoring, front-end architecture correction, implementation of a storybook, bug fixes. Tech: React, Storybook"
    },
    {
      "program": "Loki",
      "client": "Internal frog",
      "role": "Developer",
      "date": "(01/22 - 06/22)",
      "context": "Application to reference the skills and preferences of frog employees.",
      "contribution": "Implementation of tech tools, design, front-end development, testing, documentation. Tech: React, Apollo (GraphQL), Tailwind, Storybook"
    }
  ]
}
